{
  "schemaVersion": "deployment-manifest/1",
  "deploymentId": "019a0000-0000-7000-8000-000000000501",
  "agentId": "019a0000-0000-7000-8000-000000000001",
  "mode": "paper",
  "networkRef": "paper-monad",
  "strategyRevisionId": "019a0000-0000-7000-8000-000000000002",
  "strategyHash": "0xdddddddddddddddddddddddddddddddddddddddddddddddddddddddddddddddd",
  "catalogHash": "0xeeeeeeeeeeeeeeeeeeeeeeeeeeeeeeeeeeeeeeeeeeeeeeeeeeeeeeeeeeeeeeee",
  "connectorVersions": {
    "paper.uniswap": "1.0.0"
  },
  "modelProfiles": {},
  "resourceProfileRef": "paper-small-v1",
  "runtimeImageDigest": "0x5a5a5a5a5a5a5a5a5a5a5a5a5a5a5a5a5a5a5a5a5a5a5a5a5a5a5a5a5a5a5a5a",
  "budgetVersion": 1,
  "policyVersion": 1,
  "estimateId": "019a0000-0000-7000-8000-000000000003",
  "simulationAccountId": "019a0000-0000-7000-8000-000000000502"
}
